news_headline,news_article,news_category,full_text,clean_text
Russia trolls spreading misinformation about vaccines: Study,"Bots and Russian trolls on Twitter are spreading misinformation about vaccines to​ create social discord and distribute malicious content, researchers from US' Johns Hopkins University and George Washington University have claimed. By spreading both pro and anti-vaccination messages, the trolls were eroding public trust in vaccination and exposing everyone to the risk of infectious diseases, researchers said.",world,"Russia trolls spreading misinformation about vaccines: Study. Bots and Russian trolls on Twitter are spreading misinformation about vaccines to​ create social discord and distribute malicious content, researchers from US' Johns Hopkins University and George Washington University have claimed. By spreading both pro and anti-vaccination messages, the trolls were eroding public trust in vaccination and exposing everyone to the risk of infectious diseases, researchers said.",russia troll spread misinformation vaccine study bot russian troll twitter spread misinformation vaccine create social discord distribute malicious content researcher us johns hopkin university george washington university claim spread pro anti vaccination message troll erode public trust vaccination expose everyone risk infectious disease researcher say
Scotland 1st country to give students free sanitary products,"Scotland has become the world's first country to provide free sanitary products to all students in a bid to tackle ""period poverty"". Nearly 4 lakh pupils and students are expected to benefit from the Scottish government's scheme. The move primarily aims to ensure that students do not miss out on education due to lack of access to sanitary products.",world,"Scotland 1st country to give students free sanitary products. Scotland has become the world's first country to provide free sanitary products to all students in a bid to tackle ""period poverty"". Nearly 4 lakh pupils and students are expected to benefit from the Scottish government's scheme. The move primarily aims to ensure that students do not miss out on education due to lack of access to sanitary products.",scotland st country give student free sanitary product scotland become world first country provide free sanitary product student bid tackle period poverty nearly lakh pupil student expect benefit scottish government scheme move primarily aim ensure student not miss education due lack access sanitary product
Mexican farmers accuse Volkswagen of altering weather,"Mexican farmers have accused German carmaker Volkswagen of ""arbitrarily"" provoking a drought in the state of Puebla, where it operates its largest car factory outside of Germany. Volkswagen has installed hail cannons at the plant to prevent the formation of hailstones. The farmers claimed that the technology has prevented rainfall and caused a loss of 2,000 hectares of crops.",world,"Mexican farmers accuse Volkswagen of altering weather. Mexican farmers have accused German carmaker Volkswagen of ""arbitrarily"" provoking a drought in the state of Puebla, where it operates its largest car factory outside of Germany. Volkswagen has installed hail cannons at the plant to prevent the formation of hailstones. The farmers claimed that the technology has prevented rainfall and caused a loss of 2,000 hectares of crops.",mexican farmer accuse volkswagen alter weather mexican farmer accuse german carmaker volkswagen arbitrarily provoke drought state puebla operate large car factory outside germany volkswagen instal hail cannon plant prevent formation hailstone farmer claim technology prevent rainfall cause loss hectare crop
"US, Afghanistan reject Russia-led peace talks with Taliban","The US and Afghanistan will not attend Russia-led peace talks in Moscow next month. While the US has claimed that the talks will not yield any progress towards ending the 17-year-old war, Afghanistan said that it will hold only direct talks with the Taliban. Meanwhile, the Taliban militant group has confirmed that it will send a delegation to Russia.",world,"US, Afghanistan reject Russia-led peace talks with Taliban. The US and Afghanistan will not attend Russia-led peace talks in Moscow next month. While the US has claimed that the talks will not yield any progress towards ending the 17-year-old war, Afghanistan said that it will hold only direct talks with the Taliban. Meanwhile, the Taliban militant group has confirmed that it will send a delegation to Russia.",us afghanistan reject russia lead peace talk taliban us afghanistan not attend russia lead peace talk moscow next month us claim talk not yield progress towards end year old war afghanistan say hold direct talk taliban meanwhile taliban militant group confirm send delegation russia
Secret tunnel from Mexico to abandoned KFC in US discovered,"The US authorities have discovered a secret tunnel leading from a bedroom in Mexico to an abandoned KFC restaurant in the US state of Arizona, which is believed to have been used for smuggling drugs. The discovery was made last week after the abandoned building's owner Ivan López was arrested for possessing drugs worth more than $1 million. ",world,"Secret tunnel from Mexico to abandoned KFC in US discovered. The US authorities have discovered a secret tunnel leading from a bedroom in Mexico to an abandoned KFC restaurant in the US state of Arizona, which is believed to have been used for smuggling drugs. The discovery was made last week after the abandoned building's owner Ivan López was arrested for possessing drugs worth more than $1 million. ",secret tunnel mexico abandon kfc us discover us authority discover secret tunnel lead bedroom mexico abandon kfc restaurant us state arizona believe use smuggle drug discovery make last week abandon building owner ivan lopez arrest possess drug worth million
Venezuelan migration nears 2015 refugee crisis: UN,"The migration by Venezuelans is nearing a moment similar to the 2015 refugee crisis in the Mediterranean, the UN's International Organization for Migration has said. Venezuelans have been fleeing the ongoing political and economic crisis in their country that has caused a shortage of food, medicine and basic goods. Over 1.6 million Venezuelans have fled the country since 2015.",world,"Venezuelan migration nears 2015 refugee crisis: UN. The migration by Venezuelans is nearing a moment similar to the 2015 refugee crisis in the Mediterranean, the UN's International Organization for Migration has said. Venezuelans have been fleeing the ongoing political and economic crisis in their country that has caused a shortage of food, medicine and basic goods. Over 1.6 million Venezuelans have fled the country since 2015.",venezuelan migration near refugee crisis un migration venezuelan near moment similar refugee crisis mediterranean uns international organization migration say venezuelan flee ongoing political economic crisis country cause shortage food medicine basic good million venezuelan flee country since
Former Spanish dictator Francisco Franco's body to be dug up,"The Spanish government has passed a decree to exhume the remains of former dictator Francisco Franco. He was buried at the Valley of the Fallen memorial site, which was built to honour those who died during the 1936-39 Spanish civil war. The decree is pending approval by the Spanish Parliament. ",world,"Former Spanish dictator Francisco Franco's body to be dug up. The Spanish government has passed a decree to exhume the remains of former dictator Francisco Franco. He was buried at the Valley of the Fallen memorial site, which was built to honour those who died during the 1936-39 Spanish civil war. The decree is pending approval by the Spanish Parliament. ",former spanish dictator francisco franco body dig spanish government pass decree exhume remain former dictator francisco franco bury valley fall memorial site build honour die spanish civil war decree pend approval spanish parliament
Sweden releases 'Feminist Foreign Policy' manual,"Sweden has released its 'Feminist Foreign Policy' manual, which the government claimed was launched in 2014 ""in response to the discrimination and systematic subordination"" faced by women. The policy aims to fight sexual violence against women and enhance their political participation among others. It claims that gender equality is essential to achieve peace, security and sustainable development. ",world,"Sweden releases 'Feminist Foreign Policy' manual. Sweden has released its 'Feminist Foreign Policy' manual, which the government claimed was launched in 2014 ""in response to the discrimination and systematic subordination"" faced by women. The policy aims to fight sexual violence against women and enhance their political participation among others. It claims that gender equality is essential to achieve peace, security and sustainable development. ",sweden release feminist foreign policy manual sweden release feminist foreign policy manual government claim launch response discrimination systematic subordination face woman policy aim fight sexual violence woman enhance political participation among claim gender equality essential achieve peace security sustainable development
"China plans to build houses, roads in Sri Lanka","China is planning to construct rural infrastructure in Sri Lanka, including houses, roads and water storage facilities. Much of the infrastructure was destroyed during the course of the civil war in Sri Lanka. The Sri Lankan Opposition has previously opposed Chinese projects, calling them a sell out of the country's national assets.",world,"China plans to build houses, roads in Sri Lanka. China is planning to construct rural infrastructure in Sri Lanka, including houses, roads and water storage facilities. Much of the infrastructure was destroyed during the course of the civil war in Sri Lanka. The Sri Lankan Opposition has previously opposed Chinese projects, calling them a sell out of the country's national assets.",china plan build house road sri lanka china plan construct rural infrastructure sri lanka include house road water storage facility much infrastructure destroy course civil war sri lanka sri lankan opposition previously oppose chinese project call sell countrys national asset
