news_headline,news_article,news_category,full_text,clean_text
Azhar to offer 'free advice' to Goa team after son's inclusion,"Ex-India captain Mohammed Azharuddin will offer ""free expert advice"" to Goa Ranji team following his son's inclusion, a Goa Cricket Association official said. ""Because Asaduddin is his son and he's now a part of our team, we'll get Azharuddin's guidance for free. The expert assistance from someone of the stature of Azharuddin will work wonders,"" he added.",sports,"Azhar to offer 'free advice' to Goa team after son's inclusion. Ex-India captain Mohammed Azharuddin will offer ""free expert advice"" to Goa Ranji team following his son's inclusion, a Goa Cricket Association official said. ""Because Asaduddin is his son and he's now a part of our team, we'll get Azharuddin's guidance for free. The expert assistance from someone of the stature of Azharuddin will work wonders,"" he added.",azhar offer free advice goa team son inclusion ex india captain mohammed azharuddin offer free expert advice goa ranji team follow son inclusion goa cricket association official say asaduddin son part team get azharuddin guidance free expert assistance someone stature azharuddin work wonder add
Ronaldo misses open goal in Juventus' 2-0 win over Lazio,"Portugal forward Cristiano Ronaldo missed an open goal but managed to create one for Mario Mandžukić with his attempt as Juventus sailed to a 2-0 win over Lazio on Saturday. The first goal came through Miralem Pjanic's volley, while the second came after Ronaldo failed to convert from a cross. Juventus now have two wins in two league matches.",sports,"Ronaldo misses open goal in Juventus' 2-0 win over Lazio. Portugal forward Cristiano Ronaldo missed an open goal but managed to create one for Mario Mandžukić with his attempt as Juventus sailed to a 2-0 win over Lazio on Saturday. The first goal came through Miralem Pjanic's volley, while the second came after Ronaldo failed to convert from a cross. Juventus now have two wins in two league matches.",ronaldo miss open goal juventus win lazio portugal forward cristiano ronaldo miss open goal manage create one mario mandzukic attempt juventus sail win lazio saturday first goal come miralem pjanic volley second come ronaldo fail convert cross juventus two win two league match
LA hotel charges baseball player $1 mn for beating home side,"A hotel in Los Angeles' Beverly Hills added $1 million as an upcharge in Houston Astros' pitcher Justin Verlander's bill as he had helped his side beat local team Los Angeles Dodgers in the MLB World Series. Verlander, who shared a photo of the bill on Instagram, captioned the post, ""#BeverlyHillsHotel really making me pay for that World Series win.""",sports,"LA hotel charges baseball player $1 mn for beating home side. A hotel in Los Angeles' Beverly Hills added $1 million as an upcharge in Houston Astros' pitcher Justin Verlander's bill as he had helped his side beat local team Los Angeles Dodgers in the MLB World Series. Verlander, who shared a photo of the bill on Instagram, captioned the post, ""#BeverlyHillsHotel really making me pay for that World Series win.""",la hotel charge baseball player mn beat home side hotel los angele beverly hill add million upcharge houston astro pitcher justin verlander bill help side beat local team lo angele dodger mlb world series verlander share photo bill instagram caption post beverlyhillshotel really make pay world series win
Boxer wins without fighting as opponent leaves at opening bell,"Nigerian boxer Efe Ajagba won the super heavyweight match at a Premier Boxing Champions event in Minneapolis after his opponent Curtis Harper left the ring immediately after the opening bell rang. Harper reportedly left because he felt disrespected by the pay he was receiving for the bout. Harper also reportedly told a reporter that he wanted to ""make a statement"".",sports,"Boxer wins without fighting as opponent leaves at opening bell. Nigerian boxer Efe Ajagba won the super heavyweight match at a Premier Boxing Champions event in Minneapolis after his opponent Curtis Harper left the ring immediately after the opening bell rang. Harper reportedly left because he felt disrespected by the pay he was receiving for the bout. Harper also reportedly told a reporter that he wanted to ""make a statement"".",boxer win without fight opponent leaf open bell nigerian boxer efe ajagba win super heavyweight match premier boxing champion event minneapolis opponent curtis harper leave ring immediately open bell ring harper reportedly leave feel disrespect pay receive bout harper also reportedly tell reporter want make statement
"Defending champs City held to a draw, Liverpool take top spot","Current Premier League defending champions Manchester City were held to a 1-1 draw against the Wolverhampton Wanderers on Saturday. City's Aymeric Laporte scored his first goal in the Premier League. Meanwhile, Liverpool took the top spot in the points table after registering a 1-0 win over Brighton, with Mohamed Salah scoring his 29th goal in his 29th appearance at Anfield.",sports,"Defending champs City held to a draw, Liverpool take top spot. Current Premier League defending champions Manchester City were held to a 1-1 draw against the Wolverhampton Wanderers on Saturday. City's Aymeric Laporte scored his first goal in the Premier League. Meanwhile, Liverpool took the top spot in the points table after registering a 1-0 win over Brighton, with Mohamed Salah scoring his 29th goal in his 29th appearance at Anfield.",defend champ city hold draw liverpool take top spot current premier league defend champion manchester city hold draw wolverhampton wanderer saturday city aymeric laporte score first goal premier league meanwhile liverpool take top spot point table register win brighton mohamed salah score th goal th appearance anfield
NFL player retires to study brain trauma linked to the sport,"Julius Thomas, a player from the American football league NFL, has decided to end his career in American football to pursue a doctorate in psychology and study the brain trauma associated with American football. ""Football has serious cognitive risks, but there's still a lot to learn about the extent of them,"" the 30-year-old said.",sports,"NFL player retires to study brain trauma linked to the sport. Julius Thomas, a player from the American football league NFL, has decided to end his career in American football to pursue a doctorate in psychology and study the brain trauma associated with American football. ""Football has serious cognitive risks, but there's still a lot to learn about the extent of them,"" the 30-year-old said.",nfl player retire study brain trauma link sport julius thoma player american football league nfl decide end career american football pursue doctorate psychology study brain trauma associate american football football serious cognitive risk still lot learn extent year old say
"No confusion over UAE aid, read PM's tweet: Kerala CM","Kerala Chief Minister Pinarayi Vijayan has said that there is no confusion over UAE's aid for Kerala, as UAE ruler made the offer to PM Narendra Modi. He also asked people to read PM's tweet. PM Modi had thanked the UAE for a ""gracious offer"" after the country's Prime Minister tweeted that the UAE will offer relief to those affected.",world,"No confusion over UAE aid, read PM's tweet: Kerala CM. Kerala Chief Minister Pinarayi Vijayan has said that there is no confusion over UAE's aid for Kerala, as UAE ruler made the offer to PM Narendra Modi. He also asked people to read PM's tweet. PM Modi had thanked the UAE for a ""gracious offer"" after the country's Prime Minister tweeted that the UAE will offer relief to those affected.",no confusion uae aid read pms tweet kerala cm kerala chief minister pinarayi vijayan say no confusion uaes aid kerala uae ruler make offer pm narendra modi also ask people read pms tweet pm modi thank uae gracious offer countrys prime minister tweet uae offer relief affect
9-yr-old dies after Buddhist monk beats him for disturbing prayer,"A nine-year-old Buddhist novice died after a monk allegedly beat him with a stick and slammed his head against a pillar for disrupting a prayer session with ""playful"" behaviour. Monk Suphachai Suthiyano, 64, allegedly assaulted the boy with a bamboo stick at a temple in Thailand's Kanchanaburi. The monk was charged with assault, with the charge set to be elevated. ",world,"9-yr-old dies after Buddhist monk beats him for disturbing prayer. A nine-year-old Buddhist novice died after a monk allegedly beat him with a stick and slammed his head against a pillar for disrupting a prayer session with ""playful"" behaviour. Monk Suphachai Suthiyano, 64, allegedly assaulted the boy with a bamboo stick at a temple in Thailand's Kanchanaburi. The monk was charged with assault, with the charge set to be elevated. ",yr old die buddhist monk beat disturb prayer nine year old buddhist novice die monk allegedly beat stick slam head pillar disrupt prayer session playful behaviour monk suphachai suthiyano allegedly assault boy bamboo stick temple thailand kanchanaburi monk charge assault charge set elevated
Former US presidential candidate John McCain dies aged 81,"Six-time senator and former US presidential candidate John McCain passed away on Saturday aged 81 after battling brain cancer. McCain, who lost to former President Barack Obama in 2008, had refused to support fellow Republican Donald Trump for presidency in 2016 over his remarks on women. The former fighter pilot had spent five years in captivity during the Vietnam war.",world,"Former US presidential candidate John McCain dies aged 81. Six-time senator and former US presidential candidate John McCain passed away on Saturday aged 81 after battling brain cancer. McCain, who lost to former President Barack Obama in 2008, had refused to support fellow Republican Donald Trump for presidency in 2016 over his remarks on women. The former fighter pilot had spent five years in captivity during the Vietnam war.",former us presidential candidate john mccain die age six time senator former us presidential candidate john mccain pass away saturday age battle brain cancer mccain lose former president barack obama refuse support fellow republican donald trump presidency remark woman former fighter pilot spend five year captivity vietnam war
Video of Muslim man offering namaz in gurudwara goes viral,"A video showing a Muslim man offering namaz inside a gurudwara in Malaysia's Ipoh has gone viral on social media. In the video, the man is seen offering namaz in the premises for two minutes, after which he leaves. A Sikh preacher was delivering his sermon at the same time, while the man stood at one side.",world,"Video of Muslim man offering namaz in gurudwara goes viral. A video showing a Muslim man offering namaz inside a gurudwara in Malaysia's Ipoh has gone viral on social media. In the video, the man is seen offering namaz in the premises for two minutes, after which he leaves. A Sikh preacher was delivering his sermon at the same time, while the man stood at one side.",video muslim man offer namaz gurudwara go viral video show muslim man offer namaz inside gurudwara malaysia ipoh go viral social medium video man see offer namaz premise two minute leave sikh preacher deliver sermon time man stand one side
301 people evacuated from hotel after couple die within hours,"Britain's Thomas Cook said it was evacuating all 301 customers from a hotel in Egypt's Red Sea resort town of Hurghada, after a couple died within hours of each other. Reports claimed both deaths were from heart failure, with the 69-year-old husband dying before the 63-year-old wife. The tourism firm said it had received further reports of illness among guests.  ",world,"301 people evacuated from hotel after couple die within hours. Britain's Thomas Cook said it was evacuating all 301 customers from a hotel in Egypt's Red Sea resort town of Hurghada, after a couple died within hours of each other. Reports claimed both deaths were from heart failure, with the 69-year-old husband dying before the 63-year-old wife. The tourism firm said it had received further reports of illness among guests.  ",people evacuate hotel couple die within hour britain thoma cook say evacuate customer hotel egypt red sea resort town hurghada couple die within hour report claim death heart failure year old husband die year old wife tourism firm say receive report illness among guest
Takes two to tango: Pak Foreign Minister on ties with India,"Pakistan's newly-appointed Foreign Minister Shah Mahmood Qureshi on Friday said that a dialogue was essential for improving relations with India, adding that ""it takes two to tango"". He stated that Pakistan is not shy of engagement and recalled PM Imran Khan's first address wherein the former cricketer had said, ""You take one step, we will take two.""",world,"Takes two to tango: Pak Foreign Minister on ties with India. Pakistan's newly-appointed Foreign Minister Shah Mahmood Qureshi on Friday said that a dialogue was essential for improving relations with India, adding that ""it takes two to tango"". He stated that Pakistan is not shy of engagement and recalled PM Imran Khan's first address wherein the former cricketer had said, ""You take one step, we will take two.""",take two tango pak foreign minister tie india pakistan newly appoint foreign minister shah mahmood qureshi friday say dialogue essential improve relation india add take two tango state pakistan not shy engagement recall pm imran khan first address wherein former cricketer say take one step take two
Rohingya camp in Bangladesh is world's largest refugee camp,"An estimated 1 million Rohingya refugees live in the Kutupalong settlement in Cox's Bazar, Bangladesh, which is the largest refugee camp in the world. Over 7 lakh Rohingyas housed in Cox's Bazar fled attacks by the Myanmar military under the crackdown that began on August 25, 2017. Myanmar and Bangladesh reached a deal last year to repatriate the Rohingya refugees.",world,"Rohingya camp in Bangladesh is world's largest refugee camp. An estimated 1 million Rohingya refugees live in the Kutupalong settlement in Cox's Bazar, Bangladesh, which is the largest refugee camp in the world. Over 7 lakh Rohingyas housed in Cox's Bazar fled attacks by the Myanmar military under the crackdown that began on August 25, 2017. Myanmar and Bangladesh reached a deal last year to repatriate the Rohingya refugees.",rohingya camp bangladesh world large refugee camp estimate million rohingya refugee live kutupalong settlement coxs bazar bangladesh large refugee camp world lakh rohingyas house coxs bazar flee attack myanmar military crackdown begin august myanmar bangladesh reach deal last year repatriate rohingya refugee
42 Pakistanis die during Hajj pilgrimage in Saudi Arabia,"At least 42 Pakistanis have died during the ongoing Hajj pilgrimage in Saudi Arabia, Pakistan's Ministry of Religious Affairs and Interfaith Harmony said. Most of the pilgrims died due to suffocation or road accidents. As per official 
figures, over 1.84 lakh Pakistani pilgrims have reached Saudi Arabia to perform Hajj this year.
",world,"42 Pakistanis die during Hajj pilgrimage in Saudi Arabia. At least 42 Pakistanis have died during the ongoing Hajj pilgrimage in Saudi Arabia, Pakistan's Ministry of Religious Affairs and Interfaith Harmony said. Most of the pilgrims died due to suffocation or road accidents. As per official 
figures, over 1.84 lakh Pakistani pilgrims have reached Saudi Arabia to perform Hajj this year.
",pakistani die hajj pilgrimage saudi arabia least pakistani die ongoing hajj pilgrimage saudi arabia pakistan ministry religious affair interfaith harmony say pilgrim die due suffocation road accident per official figure lakh pakistani pilgrim reach saudi arabia perform hajj year
We're not making progress on N Korea denuclearisation: Trump,"US President Donald Trump on Friday said that ""sufficient"" progress was not being made on the denuclearisation of the Korean Peninsula and therefore postponed State Secretary Mike Pompeo's visit to the country. He further slammed China for not helping in the process, citing the ongoing trade war between the two countries.",world,"We're not making progress on N Korea denuclearisation: Trump. US President Donald Trump on Friday said that ""sufficient"" progress was not being made on the denuclearisation of the Korean Peninsula and therefore postponed State Secretary Mike Pompeo's visit to the country. He further slammed China for not helping in the process, citing the ongoing trade war between the two countries.",not make progress n korea denuclearisation trump us president donald trump friday say sufficient progress not make denuclearisation korean peninsula therefore postpone state secretary mike pompeo visit country slam china not help process cite ongoing trade war two country
"FB invites Google, Twitter to discuss US election meddling","Facebook has invited representatives from technology giants like Google, Microsoft and Twitter among others to discuss plans to counter misinformation during US midterm elections. This comes as Facebook was recently involved in a data scandal where Cambridge Analytica exploited data of over 50 million users to influence the US elections. The meeting will take place on Friday at Twitter's headquarters.",world,"FB invites Google, Twitter to discuss US election meddling. Facebook has invited representatives from technology giants like Google, Microsoft and Twitter among others to discuss plans to counter misinformation during US midterm elections. This comes as Facebook was recently involved in a data scandal where Cambridge Analytica exploited data of over 50 million users to influence the US elections. The meeting will take place on Friday at Twitter's headquarters.",fb invite google twitter discuss us election meddling facebook invite representative technology giant like google microsoft twitter among discuss plan counter misinformation us midterm election come facebook recently involve data scandal cambridge analytica exploit datum million user influence us election meeting take place friday twitter headquarters
19 killed in fire at hotel in China,"At least 19 people were killed after a fire broke out at a hotel in the Chinese city of Harbin on Saturday, officials said. It took over 100 firefighters three hours to extinguish the blaze at the Bailong Hot Springs Leisure Hotel. The fire reportedly broke out in a kitchen on the hotel's second floor.",world,"19 killed in fire at hotel in China. At least 19 people were killed after a fire broke out at a hotel in the Chinese city of Harbin on Saturday, officials said. It took over 100 firefighters three hours to extinguish the blaze at the Bailong Hot Springs Leisure Hotel. The fire reportedly broke out in a kitchen on the hotel's second floor.",kill fire hotel china least people kill fire break hotel chinese city harbin saturday official say take firefighter three hour extinguish blaze bailong hot spring leisure hotel fire reportedly break kitchen hotel second floor
Trump's accusations over North Korea 'irresponsible': China,"China on Saturday called US President Donald Trump's accusations that it was not helping with the denuclearisation of the Korean Peninsula ""irresponsible"". Trump had cited the ongoing trade war with China as the reason for lack of its efforts. ""All parties should...show more sincerity, instead of being capricious and put the blame on others,"" the Chinese Foreign Ministry said.",world,"Trump's accusations over North Korea 'irresponsible': China. China on Saturday called US President Donald Trump's accusations that it was not helping with the denuclearisation of the Korean Peninsula ""irresponsible"". Trump had cited the ongoing trade war with China as the reason for lack of its efforts. ""All parties should...show more sincerity, instead of being capricious and put the blame on others,"" the Chinese Foreign Ministry said.",trump accusation north korea irresponsible china china saturday call us president donald trump accusation not help denuclearisation korean peninsula irresponsible trump cite ongoing trade war china reason lack effort party show sincerity instead capricious put blame chinese foreign ministry say
UK intercepts Russian aircraft over Black Sea,The UK's Royal Air Force has intercepted a Russian maritime patrol aircraft over the Black Sea for the second time in a week. The aircraft was seen heading from the Crimea region towards NATO airspace. The Royal Air Force has deployed Typhoon jets to the Baltic nations as part of the NATO's 'Enhanced Air Policing' mission to protect NATO airspace.,world,UK intercepts Russian aircraft over Black Sea. The UK's Royal Air Force has intercepted a Russian maritime patrol aircraft over the Black Sea for the second time in a week. The aircraft was seen heading from the Crimea region towards NATO airspace. The Royal Air Force has deployed Typhoon jets to the Baltic nations as part of the NATO's 'Enhanced Air Policing' mission to protect NATO airspace.,uk intercept russian aircraft black sea uks royal air force intercept russian maritime patrol aircraft black sea second time week aircraft see head crimea region towards nato airspace royal air force deploy typhoon jet baltic nation part nato enhance air police mission protect nato airspace
"Pakistan bans first-class air travel for President, PM","Pakistan has banned first-class air travel for the President, Prime Minister, Chief Justice and other top officials. All top Pakistani government officials will now be eligible to travel in club or business class only. The decision was taken at a meeting chaired by Pakistan's Prime Minister Imran Khan on Friday. ",world,"Pakistan bans first-class air travel for President, PM. Pakistan has banned first-class air travel for the President, Prime Minister, Chief Justice and other top officials. All top Pakistani government officials will now be eligible to travel in club or business class only. The decision was taken at a meeting chaired by Pakistan's Prime Minister Imran Khan on Friday. ",pakistan ban first class air travel president pm pakistan ban first class air travel president prime minister chief justice top official top pakistani government official eligible travel club business class decision take meeting chair pakistan prime minister imran khan friday
US scraps $200-million aid to Palestinians,"The US State Department on Friday announced it had cancelled over $200 million in aid for Palestinians in the West Bank and Gaza Strip. The US had earlier this year withheld an aid of $65 million to UNRWA, the UN agency for Palestinian refugees. Relations between Palestine and the US have become strained after it recognised Jerusalem as Israel's capital. ",world,"US scraps $200-million aid to Palestinians. The US State Department on Friday announced it had cancelled over $200 million in aid for Palestinians in the West Bank and Gaza Strip. The US had earlier this year withheld an aid of $65 million to UNRWA, the UN agency for Palestinian refugees. Relations between Palestine and the US have become strained after it recognised Jerusalem as Israel's capital. ",us scrap million aid palestinian us state department friday announce cancel million aid palestinian west bank gaza strip us earlier year withhold aid million unrwa un agency palestinian refugee relation palestine us become strained recognise jerusalem israel capital
Social media giants are silencing millions of people: Trump,"US President Donald Trump on Friday said that the social media companies were ""silencing"" millions of people through censorship. Trump had said last week that social media platforms were discriminating against people with right-wing views. Twitter CEO Jack Dorsey recently admitted that Twitter employees are ""more left-leaning"" but claimed that they were ""not adding"" their ""own bias"".",world,"Social media giants are silencing millions of people: Trump. US President Donald Trump on Friday said that the social media companies were ""silencing"" millions of people through censorship. Trump had said last week that social media platforms were discriminating against people with right-wing views. Twitter CEO Jack Dorsey recently admitted that Twitter employees are ""more left-leaning"" but claimed that they were ""not adding"" their ""own bias"".",social medium giant silence million people trump us president donald trump friday say social medium company silence million people censorship trump say last week social medium platform discriminate people right wing view twitter ceo jack dorsey recently admit twitter employee left leaning claim not add bias
